{
  "entity_id": "urn:psoul:entity:f9ddd401cb64a131",
  "entity_type": "skill",
  "content": "---\nname: triage-incident\ndescription: Triage infrastructure incidents using workspace playbook and retained preferences.\nversion: 1.0.0\n---\n\n# Triage Incident\n\nLoad this skill when the user reports production incidents, OOM kills, or requests incident root-cause analysis.\n\n## Steps\n\n1. Recall workspace playbook from `knowledge/concepts/incident-triage.md`\n2. Check retained preferences in memory graph\n3. Gather pod events and memory metrics from sandbox tools\n4. Document findings in workspace context\n5. Propose remediation with provenance-linked sources\n\n## References\n\nSee `references/standard_operating_procedure.md` for escalation paths.\n",
  "content_hash": "sha256:29f1a88f085f54872982058538392ef3601357025f416b68f72120957b04ad1e",
  "prov": {
    "generated_by": {
      "activity": "urn:psoul:activity:skill.amend",
      "agent": {
        "type": "software",
        "id": "urn:psoul:agent:core-principal-09e"
      },
      "on_behalf_of": {
        "type": "person",
        "id": "user:jdoe"
      }
    },
    "derived_from": [
      {
        "source": "urn:psoul:entity:a1b2c3d4e5f67890",
        "kind": "prior_version"
      },
      {
        "source": "urn:psoul:session:2026-06-14T17:22:00Z#turn-12",
        "kind": "conversation"
      }
    ],
    "generated_at": "2026-06-15T09:30:00Z",
    "in_context": "urn:psoul:workspace:incident-response"
  }
}
